What color is a lemon?%,%The color of a lemon is usually a bright shade of yellow.
What species is the dolphin?%,%The species of dolphin commonly referred to is the Bottlenose Dolphin (Tursiops truncatus).
What color is a blueberry?%,%Blue.
Who is the 23rd President of the United States?%,%Benjamin Harrison (1889-1893).
%,%Clarence E. Hoover, age 85, died Saturday, February 14, 2015 at Chapel Hill Retirement Community, Canal Winchester, Ohio. He was born August 25, 1929, Jackson Center, Ohio to the late Virgil and Nellie (Elliott) Hoover. He married Nadine Weigel... View Obituary & Service Information
What color is a watermelon?%,%Watermelons are typically green on the outside and pink on the inside.
What color is a strawberry?%,%The color of a strawberry is usually pink or red.
What color is a grape?%,%Grapes can come in a variety of colors, including red, green, black, purple, white, and pink.
